Book Id,Title,Author,ISBN,ISBN13,My Rating,Average Rating,Publisher,Number of Pages,Year Published,Original Publication Year,Date Read,Date Added,Bookshelves,Read Count,Series
187065,"New Spring (The Wheel of Time, #0)",Robert Jordan,1841492612,9781841492612.0,4,4.05,Orbit,423,2004.0,2004.0,2020-08-26,2020-07-08,read,1,The Wheel of Time
47212,"Storm Front (The Dresden Files, #1)",Jim Butcher,0451457811,9780451457813.0,5,3.98,Penguin ROC,355,2000.0,2000.0,2020-08-25,2020-08-25,read,1,The Dresden Files
21411388,Shadows for Silence in the Forests of Hell,Brandon Sanderson,,,5,4.19,Tor Books,50,2013.0,2013.0,2020-08-25,2020-08-21,read,1,Stand Alone
37640636,"Lies of the Beholder (Legion, #3)",Brandon Sanderson,159606885X,9781596068858.0,5,4.13,Subterranean Press,148,2018.0,2018.0,2020-08-22,2020-07-05,read,1,Legion
20886354,"Skin Deep (Legion, #2)",Brandon Sanderson,,,5,4.13,Subterranean Press ,208,2014.0,2014.0,2020-08-22,2020-07-05,read,1,Legion
13452375,"Legion (Legion, #1)",Brandon Sanderson,1596064854,9781596064850.0,5,4.14,Subterranean Press,88,2012.0,2012.0,2020-08-22,2020-07-05,read,1,Legion
18361393,"Redemption (Infinity Blade, #2)",Brandon Sanderson,0983943028,9780983943020.0,5,3.84,ChAIR Entertainment Group,200,2013.0,2013.0,2020-08-21,2020-07-10,read,1,Infinity Blade
12796771,"Awakening (Infinity Blade, #1)",Brandon Sanderson,,,4,3.87,ChAIR Entertainment Group,128,2011.0,2011.0,2020-08-21,2020-07-10,read,1,Infinity Blade
8868764,White Sand,Brandon Sanderson,,,4,4.13,Brandon Sanderson,995,,,2020-08-20,2020-08-11,read,1,Stand Alone
8253920,"Towers of Midnight (The Wheel of Time, #13)",Robert Jordan,0765325942,9780765325945.0,5,4.46,Tom Doherty Associates TOR Fantasy,863,2010.0,2010.0,2020-08-09,2020-07-08,read,1,The Wheel of Time
13888,"Knife of Dreams (The Wheel of Time, #11)",Robert Jordan,0812577566,9780812577563.0,4,4.18,Tom Doherty Associates,860,2006.0,2005.0,2020-08-06,2020-07-08,read,1,The Wheel of Time
113435,"Crossroads of Twilight (The Wheel of Time, #10)",Robert Jordan,0312864590,9780312864590.0,4,3.8,Tor Books,704,2003.0,2003.0,2020-08-04,2020-07-08,read,1,The Wheel of Time
13891,"Winter's Heart (The Wheel of Time, #9)",Robert Jordan,081257558X,9780812575583.0,5,3.96,Tor Fantasy,780,2002.0,2000.0,2020-08-04,2020-07-08,read,1,The Wheel of Time
140974,"The Path of Daggers (The Wheel of Time, #8)",Robert Jordan,0812550293,9780812550290.0,4,3.92,Tor Books,685,1999.0,1998.0,2020-08-03,2020-07-08,read,1,The Wheel of Time
13890,"A Crown of Swords (The Wheel of Time, #7)",Robert Jordan,0812550285,9780812550283.0,5,4.06,Tor Books,880,1997.0,1996.0,2020-08-02,2020-07-08,read,2,The Wheel of Time
35231,"Lord of Chaos (The Wheel of Time, #6)",Robert Jordan,0812513754,9780812513752.0,5,4.17,Tom Doherty Associates,1011,1995.0,1994.0,2020-07-31,2020-07-08,read,1,The Wheel of Time
13895,"The Fires of Heaven (The Wheel of Time, #5)",Robert Jordan,1857232097,9781857232097.0,4,4.18,Orbit,912,1994.0,1993.0,2020-07-29,2020-07-08,read,1,The Wheel of Time
9539,"The Shadow Rising (The Wheel of Time, #4)",Robert Jordan,0812513738,9780812513738.0,5,4.26,Tom Doherty Tor Fantasy,1007,1993.0,1992.0,2020-07-28,2020-07-08,read,1,The Wheel of Time
34897,"The Dragon Reborn (The Wheel of Time, #3)",Robert Jordan,0765305119,9780765305114.0,5,4.27,Tor Books,624,2002.0,1991.0,2020-07-25,2020-07-08,read,1,The Wheel of Time
233649,"The Great Hunt (The Wheel of Time, #2)",Robert Jordan,0812517725,9780812517729.0,5,4.25,Tor Books,705,1991.0,1990.0,2020-07-23,2020-04-11,read,1,The Wheel of Time
15704486,"Calamity (Reckoners, #3)",Brandon Sanderson,0385743602,9780385743600.0,5,4.18,Delacorte Press,424,2016.0,2016.0,2020-07-15,2020-07-05,read,1,Reckoners
18966322,"Mitosis (The Reckoners, #1.5)",Brandon Sanderson,0449818438,9780449818435.0,5,3.86,Delacorte Press,55,2013.0,2013.0,2020-07-15,2020-07-05,read,1,The Reckoners
15704459,"Firefight (The Reckoners, #2)",Brandon Sanderson,0385743580,9780385743587.0,5,4.26,Delacorte Press,416,2015.0,2015.0,2020-07-15,2020-07-05,read,1,The Reckoners
17182126,"Steelheart (The Reckoners, #1)",Brandon Sanderson,0385743564,9780385743563.0,5,4.14,Delacorte Press,386,2013.0,2013.0,2020-07-14,2020-07-05,read,1,The Reckoners
18739426,"The Bands of Mourning (Mistborn, #6)",Brandon Sanderson,,,5,4.42,Tor,448,2016.0,2016.0,2020-07-03,2020-07-01,read,1,Mistborn
16065004,"Shadows of Self (Mistborn, #5)",Brandon Sanderson,0765378558,9780765378552.0,5,4.29,Tor Books,383,2015.0,2015.0,2020-07-01,2020-06-30,read,1,Mistborn
10803121,"The Alloy of Law (Mistborn, #4)",Brandon Sanderson,0765330423,9780765330420.0,5,4.21,Tor Books,332,2011.0,2011.0,2020-06-30,2020-06-30,read,1,Mistborn
34703445,"Edgedancer (The Stormlight Archive, #2.5)",Brandon Sanderson,1250166543,9781250166548.0,5,4.25,Tor Books,272,2017.0,2017.0,2020-06-26,2020-05-25,read,1,The Stormlight Archive
13578175,The Emperor's Soul (The Cosmere),Brandon Sanderson,1616960922,9781616960926.0,5,4.37,Tachyon Publications,175,2012.0,2012.0,2020-06-20,2020-06-19,read,1,Stand Alone
34002132,"Oathbringer (The Stormlight Archive, #3)",Brandon Sanderson,076532637X,9780765326379.0,5,4.61,Tor Books,1248,2017.0,2017.0,2020-06-19,2020-05-25,read,1,The Stormlight Archive
7260188,"Mockingjay (The Hunger Games, #3)",Suzanne Collins,0439023513,9780439023511.0,4,4.06,Scholastic Press,398,2010.0,2010.0,2020-06-14,2020-02-26,read,1,The Hunger Games
6148028,"Catching Fire (The Hunger Games, #2)",Suzanne Collins,0439023491,9780439023498.0,5,4.3,Scholastic Press,391,2009.0,2009.0,2020-05-23,2020-02-26,read,1,The Hunger Games
68427,"Elantris (Elantris, #1)",Brandon Sanderson,0765350378,9780765350374.0,5,4.19,Tor Fantasy,622,2006.0,2005.0,2020-05-23,2020-04-13,read,1,Elantris
2767052,"The Hunger Games (The Hunger Games, #1)",Suzanne Collins,0439023483,9780439023481.0,5,4.32,Scholastic Press,374,2008.0,2008.0,2020-05-11,2020-02-26,read,1,The Hunger Games
33590260,"Kingdom of Ash (Throne of Glass, #7)",Sarah J. Maas,1619636107,9781619636101.0,4,4.62,Bloomsbury YA,980,2018.0,2018.0,2020-05-05,2020-04-11,read,1,Throne of Glass
22733616,"Neverseen (Keeper of the Lost Cities, #4)",Shannon Messenger,,,4,4.62,Aladdin,672,2015.0,2015.0,2020-05-05,2020-04-26,read,1,Keeper of the Lost Cities
13260668,"Everblaze (Keeper of the Lost Cities, #3)",Shannon Messenger,1442445998,9781442445994.0,5,4.54,Aladdin,624,2014.0,2014.0,2020-05-03,2020-04-26,read,1,Keeper of the Lost Cities
13260670,"Exile (Keeper of the Lost Cities, #2)",Shannon Messenger,,9781442445987.0,5,4.51,Aladdin,576,2013.0,2013.0,2020-05-02,2020-04-26,read,1,Keeper of the Lost Cities
28006096,"The Burning Maze (The Trials of Apollo, #3)",Rick Riordan,1484746430,9781368024129.0,5,4.31,Disney-Hyperion,448,2018.0,2018.0,2020-05-01,2020-04-24,read,1,The Trials of Apollo
12842828,"Keeper of the Lost Cities (Keeper of the Lost Cities, #1)",Shannon Messenger,1442445939,9781442445932.0,5,4.43,Aladdin,496,2012.0,2012.0,2020-04-30,2020-04-26,read,1,Keeper of the Lost Cities
30145666,"The Dark Prophecy (The Trials of Apollo, #2)",Rick Riordan,1484746422,9781484746424.0,5,4.18,Disney-Hyperion,414,2017.0,2017.0,2020-04-28,2020-04-24,read,1,The Trials of Apollo
26252859,"The Hidden Oracle (The Trials of Apollo, #1)",Rick Riordan,148473274X,9781484732748.0,5,4.19,Disney-Hyperion,384,2016.0,2016.0,2020-04-24,2020-04-22,read,1,The Trials of Apollo
31450852,"Tower of Dawn (Throne of Glass, #6)",Sarah J. Maas,1681195771,9781681195773.0,4,4.27,Bloomsbury USA Childrens,660,2017.0,2017.0,2020-04-24,2020-04-11,read,1,Throne of Glass
28260587,"Empire of Storms (Throne of Glass, #5)",Sarah J. Maas,,,4,4.57,Bloomsbury Children's Books,689,2016.0,2016.0,2020-04-22,2020-04-11,read,1,Throne of Glass
18006496,"Queen of Shadows (Throne of Glass, #4)",Sarah J. Maas,1619636042,9781619636040.0,4,4.56,Bloomsbury USA Childrens,648,2015.0,2015.0,2020-04-18,2020-04-11,read,1,Throne of Glass
20613470,"Heir of Fire (Throne of Glass, #3)",Sarah J. Maas,1619630656,9781619630659.0,5,4.46,Bloomsbury USA Childrens,565,2014.0,2014.0,2020-04-13,2020-04-10,read,1,Throne of Glass
17167166,"Crown of Midnight (Throne of Glass, #2)",Sarah J. Maas,1619630621,9781619630628.0,5,4.36,Bloomsbury USA Childrens,420,2013.0,2013.0,2020-04-10,2020-04-09,read,1,Throne of Glass
13419891,"The Assassin and the Desert (Throne of Glass, #0.3)",Sarah J. Maas,,,4,4.39,Bloomsbury USA Childrens,103,2012.0,2012.0,2020-04-09,2020-04-09,read,1,Throne of Glass
18333581,"The Assassin and the Healer (Throne of Glass, #0.2)",Sarah J. Maas,,,4,4.21,Bloomsbury Publishing,40,2013.0,2012.0,2020-04-10,2020-04-09,read,1,Throne of Glass
13546173,"The Assassin and the Underworld (Throne of Glass, #0.4)",Sarah J. Maas,,,5,4.35,Bloomsbury USA Childrens,102,2012.0,2012.0,2020-04-10,2020-04-09,read,1,Throne of Glass
13415554,"The Assassin and the Pirate Lord (Throne of Glass, #0.1)",Sarah J. Maas,,,4,4.22,Bloomsbury Children’s,70,2012.0,2012.0,2020-04-10,2020-04-09,read,2,Throne of Glass
13565676,"The Assassin and the Empire (Throne of Glass, #0.5)",Sarah J. Maas,,,5,4.41,Bloomsbury USA Children's,94,2012.0,2012.0,2020-04-09,2020-04-09,read,1,Throne of Glass
7896527,"Throne of Glass (Throne of Glass, #1)",Sarah J. Maas,,,5,4.19,Bloomsbury USA Children's,406,2012.0,2012.0,2020-04-09,2020-04-08,read,1,Throne of Glass
28006120,"The Ship of the Dead (Magnus Chase and the Gods of Asgard, #3)",Rick Riordan,1423160932,9781423160939.0,5,4.39,Disney-Hyperion Books,410,2017.0,2017.0,2020-04-02,2020-03-26,read,1,Magnus Chase and the Gods of Asgard
15724396,"The Sword of Summer (Magnus Chase and the Gods of Asgard, #1)",Rick Riordan,1423160916,9781423160915.0,5,4.24,Disney-Hyperion Books,499,2015.0,2015.0,2020-03-14,2020-03-10,read,1,Magnus Chase and the Gods of Asgard
27904311,"The Hammer of Thor (Magnus Chase and the Gods of Asgard, #2)",Rick Riordan,1423160924,9781423160922.0,4,4.33,Disney-Hyperion Books,459,2016.0,2016.0,2020-03-20,2020-03-14,read,1,Magnus Chase and the Gods of Asgard
